{
  "$schema": "http://json-schema.org/draft-07/schema#",
  "title": "NEMA Bench Report Schema v0.1",
  "type": "object",
  "required": [
    "ok",
    "modelId",
    "bench",
    "gitCommit",
    "createdAt",
    "toolchainVersions",
    "config",
    "provenance",
    "graphResolved",
    "correctness",
    "performance",
    "hardware",
    "ticks",
    "irPath",
    "irSha256",
    "artifacts",
    "validation"
  ],
  "properties": {
    "ok": {
      "type": "boolean"
    },
    "modelId": {
      "type": "string",
      "minLength": 1
    },
    "bench": {
      "type": "object",
      "required": [
        "targetId"
      ],
      "properties": {
        "targetId": {
          "type": "string",
          "minLength": 1
        }
      }
    },
    "gitCommit": {
      "type": [
        "string",
        "null"
      ]
    },
    "createdAt": {
      "type": "string",
      "minLength": 1
    },
    "toolchainVersions": {
      "type": "object",
      "required": [
        "python",
        "g++",
        "vitis_hls",
        "vivado"
      ],
      "properties": {
        "python": {
          "type": [
            "string",
            "null"
          ]
        },
        "g++": {
          "type": [
            "string",
            "null"
          ]
        },
        "vitis_hls": {
          "type": [
            "string",
            "null"
          ]
        },
        "vivado": {
          "type": [
            "string",
            "null"
          ]
        }
      }
    },
    "config": {
      "type": "object",
      "required": [
        "qformats",
        "dt",
        "dtNanoseconds",
        "schedule",
        "graph"
      ],
      "properties": {
        "qformats": {
          "type": "object"
        },
        "dt": {
          "type": [
            "number",
            "string"
          ]
        },
        "dtNanoseconds": {
          "type": [
            "integer",
            "null"
          ]
        },
        "schedule": {
          "type": "object",
          "required": [
            "policy",
            "snapshotRule",
            "evalOrder"
          ],
          "properties": {
            "policy": {
              "type": "string"
            },
            "snapshotRule": {
              "type": "boolean"
            },
            "evalOrder": {
              "type": "string"
            }
          }
        },
        "graph": {
          "type": "object",
          "required": [
            "nodeCount",
            "chemicalEdgeCount",
            "gapEdgeCount",
            "edgeCountTotal"
          ],
          "properties": {
            "nodeCount": {
              "type": "integer",
              "minimum": 0
            },
            "chemicalEdgeCount": {
              "type": "integer",
              "minimum": 0
            },
            "gapEdgeCount": {
              "type": "integer",
              "minimum": 0
            },
            "edgeCountTotal": {
              "type": "integer",
              "minimum": 0
            }
          }
        }
      }
    },
    "provenance": {
      "type": "object",
      "required": [
        "syntheticUsed",
        "externalVerified"
      ],
      "properties": {
        "syntheticUsed": {
          "type": "boolean"
        },
        "externalVerified": {
          "type": "boolean"
        }
      }
    },
    "graphResolved": {
      "type": "object",
      "required": [
        "nodeCount",
        "edgeCounts"
      ],
      "properties": {
        "nodeCount": {
          "type": "integer",
          "minimum": 0
        },
        "edgeCounts": {
          "type": "object",
          "required": [
            "total",
            "chemical",
            "gap",
            "gapDirected"
          ],
          "properties": {
            "total": {
              "type": "integer",
              "minimum": 0
            },
            "chemical": {
              "type": "integer",
              "minimum": 0
            },
            "gap": {
              "type": "integer",
              "minimum": 0
            },
            "gapDirected": {
              "type": "integer",
              "minimum": 0
            }
          }
        }
      }
    },
    "correctness": {
      "type": "object",
      "required": [
        "goldenSim",
        "cppReference",
        "digestMatch"
      ],
      "properties": {
        "goldenSim": {
          "type": "object",
          "required": [
            "ok",
            "digests",
            "digestPath",
            "tracePath",
            "error"
          ],
          "properties": {
            "ok": {
              "type": "boolean"
            },
            "digests": {
              "type": "array",
              "items": {
                "type": "string"
              }
            },
            "digestPath": {
              "type": "string"
            },
            "tracePath": {
              "type": "string"
            },
            "error": {
              "type": [
                "string",
                "null"
              ]
            }
          }
        },
        "cppReference": {
          "type": "object",
          "required": [
            "ok",
            "digests",
            "binaryPath",
            "error"
          ],
          "properties": {
            "ok": {
              "type": "boolean"
            },
            "digests": {
              "type": "array",
              "items": {
                "type": "string"
              }
            },
            "binaryPath": {
              "type": [
                "string",
                "null"
              ]
            },
            "error": {
              "type": [
                "string",
                "null"
              ]
            }
          }
        },
        "digestMatch": {
          "type": "object",
          "required": [
            "ok",
            "mismatchTick"
          ],
          "properties": {
            "ok": {
              "type": "boolean"
            },
            "mismatchTick": {
              "type": [
                "integer",
                "null"
              ]
            }
          }
        }
      }
    },
    "performance": {
      "type": "object",
      "required": [
        "cpu",
        "hardware"
      ],
      "properties": {
        "cpu": {
          "type": "object",
          "required": [
            "goldenTicksPerSecond",
            "cppRefTicksPerSecond",
            "goldenElapsedSeconds",
            "cppRefElapsedSeconds"
          ]
        },
        "hardware": {
          "type": [
            "object",
            "null"
          ]
        }
      }
    },
    "hardware": {
      "type": "object",
      "required": [
        "toolchain",
        "project",
        "csim",
        "csynth",
        "cosim",
        "vivado",
        "reports",
        "qor"
      ],
      "properties": {
        "toolchain": {
          "type": "object",
          "required": [
            "available",
            "binary",
            "version",
            "vivadoAvailable",
            "vivadoBinary",
            "vivadoVersion"
          ],
          "properties": {
            "available": {
              "type": "boolean"
            },
            "binary": {
              "type": [
                "string",
                "null"
              ]
            },
            "version": {
              "type": [
                "string",
                "null"
              ]
            },
            "vivadoAvailable": {
              "type": "boolean"
            },
            "vivadoBinary": {
              "type": [
                "string",
                "null"
              ]
            },
            "vivadoVersion": {
              "type": [
                "string",
                "null"
              ]
            }
          }
        },
        "project": {
          "type": [
            "string",
            "null"
          ]
        },
        "csim": {
          "type": [
            "object",
            "null"
          ]
        },
        "csynth": {
          "type": [
            "object",
            "null"
          ]
        },
        "cosim": {
          "type": [
            "object",
            "null"
          ]
        },
        "vivado": {
          "type": "object",
          "required": [
            "attempted",
            "ok",
            "skipped",
            "reason",
            "returncode",
            "elapsedSeconds",
            "projectDir",
            "runLog",
            "utilizationReport",
            "timingReport",
            "rtlSourceCount",
            "utilization",
            "timing",
            "sourceReports"
          ],
          "properties": {
            "attempted": {
              "type": "boolean"
            },
            "ok": {
              "type": [
                "boolean",
                "null"
              ]
            },
            "skipped": {
              "type": "boolean"
            },
            "reason": {
              "type": [
                "string",
                "null"
              ]
            },
            "returncode": {
              "type": [
                "integer",
                "null"
              ]
            },
            "elapsedSeconds": {
              "type": [
                "number",
                "null"
              ]
            },
            "projectDir": {
              "type": [
                "string",
                "null"
              ]
            },
            "runLog": {
              "type": [
                "string",
                "null"
              ]
            },
            "utilizationReport": {
              "type": [
                "string",
                "null"
              ]
            },
            "timingReport": {
              "type": [
                "string",
                "null"
              ]
            },
            "rtlSourceCount": {
              "type": "integer",
              "minimum": 0
            },
            "utilization": {
              "type": "object",
              "required": [
                "lut",
                "ff",
                "bram",
                "dsp"
              ],
              "properties": {
                "lut": {
                  "type": [
                    "integer",
                    "number",
                    "null"
                  ]
                },
                "ff": {
                  "type": [
                    "integer",
                    "number",
                    "null"
                  ]
                },
                "bram": {
                  "type": [
                    "integer",
                    "number",
                    "null"
                  ]
                },
                "dsp": {
                  "type": [
                    "integer",
                    "number",
                    "null"
                  ]
                }
              }
            },
            "timing": {
              "type": "object",
              "required": [
                "wns",
                "tns",
                "whs",
                "ths",
                "failingEndpoints"
              ],
              "properties": {
                "wns": {
                  "type": [
                    "number",
                    "null"
                  ]
                },
                "tns": {
                  "type": [
                    "number",
                    "null"
                  ]
                },
                "whs": {
                  "type": [
                    "number",
                    "null"
                  ]
                },
                "ths": {
                  "type": [
                    "number",
                    "null"
                  ]
                },
                "failingEndpoints": {
                  "type": [
                    "integer",
                    "number",
                    "null"
                  ]
                }
              }
            },
            "sourceReports": {
              "type": "array",
              "items": {
                "type": "string"
              }
            }
          }
        },
        "reports": {
          "type": [
            "object",
            "null"
          ],
          "required": [
            "files"
          ],
          "properties": {
            "files": {
              "type": "array",
              "items": {
                "type": "string"
              }
            }
          }
        },
        "qor": {
          "type": "object",
          "required": [
            "utilization",
            "ii",
            "latencyCycles",
            "timingOrLatency",
            "sourceReports"
          ],
          "properties": {
            "utilization": {
              "type": "object",
              "required": [
                "lut",
                "ff",
                "bram",
                "dsp"
              ],
              "properties": {
                "lut": {
                  "type": [
                    "integer",
                    "null"
                  ]
                },
                "ff": {
                  "type": [
                    "integer",
                    "null"
                  ]
                },
                "bram": {
                  "type": [
                    "integer",
                    "null"
                  ]
                },
                "dsp": {
                  "type": [
                    "integer",
                    "null"
                  ]
                }
              }
            },
            "ii": {
              "type": [
                "integer",
                "null"
              ]
            },
            "latencyCycles": {
              "type": [
                "integer",
                "null"
              ]
            },
            "timingOrLatency": {
              "type": "object",
              "required": [
                "ii",
                "latencyCycles"
              ],
              "properties": {
                "ii": {
                  "type": [
                    "integer",
                    "null"
                  ]
                },
                "latencyCycles": {
                  "type": [
                    "integer",
                    "null"
                  ]
                }
              }
            },
            "sourceReports": {
              "type": "array",
              "items": {
                "type": "string"
              }
            }
          }
        }
      }
    },
    "ticks": {
      "type": "integer",
      "minimum": 0
    },
    "irPath": {
      "type": "string",
      "minLength": 1
    },
    "irSha256": {
      "type": "string",
      "minLength": 1
    },
    "artifacts": {
      "type": "object",
      "required": [
        "modelRoot",
        "hlsCpp",
        "hlsHeader",
        "cppRefMain",
        "benchReport"
      ]
    },
    "validation": {
      "type": "object",
      "required": [
        "ok",
        "invariantsChecked"
      ],
      "properties": {
        "ok": {
          "type": "boolean"
        },
        "invariantsChecked": {
          "type": "array",
          "items": {
            "type": "string"
          }
        }
      }
    }
  }
}
