{
  "artifacts": {
    "benchReport": "/home/tangodelta/Escritorio/NEMA/paper_cpu_runs/b1/example_b1_small_subgraph/bench_report.json",
    "bitstream": null,
    "cppRefMain": "/home/tangodelta/Escritorio/NEMA/paper_cpu_runs/b1/example_b1_small_subgraph/cpp_ref/main.cpp",
    "hlsCpp": "/home/tangodelta/Escritorio/NEMA/paper_cpu_runs/b1/example_b1_small_subgraph/hls/nema_kernel.cpp",
    "hlsHeader": "/home/tangodelta/Escritorio/NEMA/paper_cpu_runs/b1/example_b1_small_subgraph/hls/nema_kernel.h",
    "modelRoot": "/home/tangodelta/Escritorio/NEMA/paper_cpu_runs/b1/example_b1_small_subgraph"
  },
  "bench": {
    "targetId": "example_b1_small_subgraph/CE/2-1"
  },
  "config": {
    "dt": 1.0,
    "dtNanoseconds": 1000000000,
    "graph": {
      "chemicalEdgeCount": 1,
      "edgeCountTotal": 3,
      "gapEdgeCount": 1,
      "nodeCount": 2
    },
    "qformats": {
      "accum": "Q12.8",
      "activation": "Q8.8",
      "lutInput": "Q8.8",
      "lutOutput": "Q8.8",
      "voltage": "Q8.8"
    },
    "schedule": {
      "evalOrder": "index",
      "neuronLanes": 1,
      "policy": "nema.tick.v0.1",
      "snapshotRule": true,
      "synapseLanes": 1
    }
  },
  "correctness": {
    "cppReference": {
      "binaryPath": "/home/tangodelta/Escritorio/NEMA/paper_cpu_runs/b1/example_b1_small_subgraph/cpp_ref/nema_cpp_ref",
      "digests": [
        "df3f619804a92fdb4057192dc43dd748ea778adc52bc498ce80524c014b81119",
        "df3f619804a92fdb4057192dc43dd748ea778adc52bc498ce80524c014b81119",
        "df3f619804a92fdb4057192dc43dd748ea778adc52bc498ce80524c014b81119",
        "df3f619804a92fdb4057192dc43dd748ea778adc52bc498ce80524c014b81119",
        "df3f619804a92fdb4057192dc43dd748ea778adc52bc498ce80524c014b81119",
        "df3f619804a92fdb4057192dc43dd748ea778adc52bc498ce80524c014b81119",
        "df3f619804a92fdb4057192dc43dd748ea778adc52bc498ce80524c014b81119",
        "df3f619804a92fdb4057192dc43dd748ea778adc52bc498ce80524c014b81119",
        "df3f619804a92fdb4057192dc43dd748ea778adc52bc498ce80524c014b81119",
        "df3f619804a92fdb4057192dc43dd748ea778adc52bc498ce80524c014b81119",
        "df3f619804a92fdb4057192dc43dd748ea778adc52bc498ce80524c014b81119",
        "df3f619804a92fdb4057192dc43dd748ea778adc52bc498ce80524c014b81119",
        "df3f619804a92fdb4057192dc43dd748ea778adc52bc498ce80524c014b81119",
        "df3f619804a92fdb4057192dc43dd748ea778adc52bc498ce80524c014b81119",
        "df3f619804a92fdb4057192dc43dd748ea778adc52bc498ce80524c014b81119",
        "df3f619804a92fdb4057192dc43dd748ea778adc52bc498ce80524c014b81119",
        "df3f619804a92fdb4057192dc43dd748ea778adc52bc498ce80524c014b81119",
        "df3f619804a92fdb4057192dc43dd748ea778adc52bc498ce80524c014b81119",
        "df3f619804a92fdb4057192dc43dd748ea778adc52bc498ce80524c014b81119",
        "df3f619804a92fdb4057192dc43dd748ea778adc52bc498ce80524c014b81119",
        "df3f619804a92fdb4057192dc43dd748ea778adc52bc498ce80524c014b81119",
        "df3f619804a92fdb4057192dc43dd748ea778adc52bc498ce80524c014b81119",
        "df3f619804a92fdb4057192dc43dd748ea778adc52bc498ce80524c014b81119",
        "df3f619804a92fdb4057192dc43dd748ea778adc52bc498ce80524c014b81119",
        "df3f619804a92fdb4057192dc43dd748ea778adc52bc498ce80524c014b81119",
        "df3f619804a92fdb4057192dc43dd748ea778adc52bc498ce80524c014b81119",
        "df3f619804a92fdb4057192dc43dd748ea778adc52bc498ce80524c014b81119",
        "df3f619804a92fdb4057192dc43dd748ea778adc52bc498ce80524c014b81119",
        "df3f619804a92fdb4057192dc43dd748ea778adc52bc498ce80524c014b81119",
        "df3f619804a92fdb4057192dc43dd748ea778adc52bc498ce80524c014b81119",
        "df3f619804a92fdb4057192dc43dd748ea778adc52bc498ce80524c014b81119",
        "df3f619804a92fdb4057192dc43dd748ea778adc52bc498ce80524c014b81119",
        "df3f619804a92fdb4057192dc43dd748ea778adc52bc498ce80524c014b81119",
        "df3f619804a92fdb4057192dc43dd748ea778adc52bc498ce80524c014b81119",
        "df3f619804a92fdb4057192dc43dd748ea778adc52bc498ce80524c014b81119",
        "df3f619804a92fdb4057192dc43dd748ea778adc52bc498ce80524c014b81119",
        "df3f619804a92fdb4057192dc43dd748ea778adc52bc498ce80524c014b81119",
        "df3f619804a92fdb4057192dc43dd748ea778adc52bc498ce80524c014b81119",
        "df3f619804a92fdb4057192dc43dd748ea778adc52bc498ce80524c014b81119",
        "df3f619804a92fdb4057192dc43dd748ea778adc52bc498ce80524c014b81119",
        "df3f619804a92fdb4057192dc43dd748ea778adc52bc498ce80524c014b81119",
        "df3f619804a92fdb4057192dc43dd748ea778adc52bc498ce80524c014b81119",
        "df3f619804a92fdb4057192dc43dd748ea778adc52bc498ce80524c014b81119",
        "df3f619804a92fdb4057192dc43dd748ea778adc52bc498ce80524c014b81119",
        "df3f619804a92fdb4057192dc43dd748ea778adc52bc498ce80524c014b81119",
        "df3f619804a92fdb4057192dc43dd748ea778adc52bc498ce80524c014b81119",
        "df3f619804a92fdb4057192dc43dd748ea778adc52bc498ce80524c014b81119",
        "df3f619804a92fdb4057192dc43dd748ea778adc52bc498ce80524c014b81119",
        "df3f619804a92fdb4057192dc43dd748ea778adc52bc498ce80524c014b81119",
        "df3f619804a92fdb4057192dc43dd748ea778adc52bc498ce80524c014b81119",
        "df3f619804a92fdb4057192dc43dd748ea778adc52bc498ce80524c014b81119",
        "df3f619804a92fdb4057192dc43dd748ea778adc52bc498ce80524c014b81119",
        "df3f619804a92fdb4057192dc43dd748ea778adc52bc498ce80524c014b81119",
        "df3f619804a92fdb4057192dc43dd748ea778adc52bc498ce80524c014b81119",
        "df3f619804a92fdb4057192dc43dd748ea778adc52bc498ce80524c014b81119",
        "df3f619804a92fdb4057192dc43dd748ea778adc52bc498ce80524c014b81119",
        "df3f619804a92fdb4057192dc43dd748ea778adc52bc498ce80524c014b81119",
        "df3f619804a92fdb4057192dc43dd748ea778adc52bc498ce80524c014b81119",
        "df3f619804a92fdb4057192dc43dd748ea778adc52bc498ce80524c014b81119",
        "df3f619804a92fdb4057192dc43dd748ea778adc52bc498ce80524c014b81119",
        "df3f619804a92fdb4057192dc43dd748ea778adc52bc498ce80524c014b81119",
        "df3f619804a92fdb4057192dc43dd748ea778adc52bc498ce80524c014b81119",
        "df3f619804a92fdb4057192dc43dd748ea778adc52bc498ce80524c014b81119",
        "df3f619804a92fdb4057192dc43dd748ea778adc52bc498ce80524c014b81119",
        "df3f619804a92fdb4057192dc43dd748ea778adc52bc498ce80524c014b81119",
        "df3f619804a92fdb4057192dc43dd748ea778adc52bc498ce80524c014b81119",
        "df3f619804a92fdb4057192dc43dd748ea778adc52bc498ce80524c014b81119",
        "df3f619804a92fdb4057192dc43dd748ea778adc52bc498ce80524c014b81119",
        "df3f619804a92fdb4057192dc43dd748ea778adc52bc498ce80524c014b81119",
        "df3f619804a92fdb4057192dc43dd748ea778adc52bc498ce80524c014b81119",
        "df3f619804a92fdb4057192dc43dd748ea778adc52bc498ce80524c014b81119",
        "df3f619804a92fdb4057192dc43dd748ea778adc52bc498ce80524c014b81119",
        "df3f619804a92fdb4057192dc43dd748ea778adc52bc498ce80524c014b81119",
        "df3f619804a92fdb4057192dc43dd748ea778adc52bc498ce80524c014b81119",
        "df3f619804a92fdb4057192dc43dd748ea778adc52bc498ce80524c014b81119",
        "df3f619804a92fdb4057192dc43dd748ea778adc52bc498ce80524c014b81119",
        "df3f619804a92fdb4057192dc43dd748ea778adc52bc498ce80524c014b81119",
        "df3f619804a92fdb4057192dc43dd748ea778adc52bc498ce80524c014b81119",
        "df3f619804a92fdb4057192dc43dd748ea778adc52bc498ce80524c014b81119",
        "df3f619804a92fdb4057192dc43dd748ea778adc52bc498ce80524c014b81119",
        "df3f619804a92fdb4057192dc43dd748ea778adc52bc498ce80524c014b81119",
        "df3f619804a92fdb4057192dc43dd748ea778adc52bc498ce80524c014b81119",
        "df3f619804a92fdb4057192dc43dd748ea778adc52bc498ce80524c014b81119",
        "df3f619804a92fdb4057192dc43dd748ea778adc52bc498ce80524c014b81119",
        "df3f619804a92fdb4057192dc43dd748ea778adc52bc498ce80524c014b81119",
        "df3f619804a92fdb4057192dc43dd748ea778adc52bc498ce80524c014b81119",
        "df3f619804a92fdb4057192dc43dd748ea778adc52bc498ce80524c014b81119",
        "df3f619804a92fdb4057192dc43dd748ea778adc52bc498ce80524c014b81119",
        "df3f619804a92fdb4057192dc43dd748ea778adc52bc498ce80524c014b81119",
        "df3f619804a92fdb4057192dc43dd748ea778adc52bc498ce80524c014b81119",
        "df3f619804a92fdb4057192dc43dd748ea778adc52bc498ce80524c014b81119",
        "df3f619804a92fdb4057192dc43dd748ea778adc52bc498ce80524c014b81119",
        "df3f619804a92fdb4057192dc43dd748ea778adc52bc498ce80524c014b81119",
        "df3f619804a92fdb4057192dc43dd748ea778adc52bc498ce80524c014b81119",
        "df3f619804a92fdb4057192dc43dd748ea778adc52bc498ce80524c014b81119",
        "df3f619804a92fdb4057192dc43dd748ea778adc52bc498ce80524c014b81119",
        "df3f619804a92fdb4057192dc43dd748ea778adc52bc498ce80524c014b81119",
        "df3f619804a92fdb4057192dc43dd748ea778adc52bc498ce80524c014b81119",
        "df3f619804a92fdb4057192dc43dd748ea778adc52bc498ce80524c014b81119",
        "df3f619804a92fdb4057192dc43dd748ea778adc52bc498ce80524c014b81119",
        "df3f619804a92fdb4057192dc43dd748ea778adc52bc498ce80524c014b81119",
        "df3f619804a92fdb4057192dc43dd748ea778adc52bc498ce80524c014b81119",
        "df3f619804a92fdb4057192dc43dd748ea778adc52bc498ce80524c014b81119",
        "df3f619804a92fdb4057192dc43dd748ea778adc52bc498ce80524c014b81119",
        "df3f619804a92fdb4057192dc43dd748ea778adc52bc498ce80524c014b81119",
        "df3f619804a92fdb4057192dc43dd748ea778adc52bc498ce80524c014b81119",
        "df3f619804a92fdb4057192dc43dd748ea778adc52bc498ce80524c014b81119",
        "df3f619804a92fdb4057192dc43dd748ea778adc52bc498ce80524c014b81119",
        "df3f619804a92fdb4057192dc43dd748ea778adc52bc498ce80524c014b81119",
        "df3f619804a92fdb4057192dc43dd748ea778adc52bc498ce80524c014b81119",
        "df3f619804a92fdb4057192dc43dd748ea778adc52bc498ce80524c014b81119",
        "df3f619804a92fdb4057192dc43dd748ea778adc52bc498ce80524c014b81119",
        "df3f619804a92fdb4057192dc43dd748ea778adc52bc498ce80524c014b81119",